,Text,Original Summary,MLE Summary,GAN Summary
49," actress aishwarya rai was honoured with the meryl streep award for excellence at the women in film and television <unk> india award. her daughter aaradhya and mother brinda rai also attended the award ceremony. apart from aishwarya, director zoya akhtar and actress janhvi kapoor, among others, were also honoured at the event. ", aishwarya rai receives meryl streep award for excellence , aishwarya rai receives meryl streep award for excellence , aishwarya rai honoured meryl streep excellence for excellence 
50," pakistani batsman ahmad shahzad took to twitter to share a picture of himself with cricket legend wasim akram while working out ahead of the third season of pakistan super league in dubai. shahzad will play for multan sultans in psl, while akram is the director of cricketing operations for the franchise. this will be sultans' first-ever season in the psl. ", pak cricketer shahzad shares workout pic with wasim akram , pak cricketer shahzad workout workout workout wasim akram , pak cricketer shahzad workout workout wasim 
51," the world's first ""negative <unk> plant that turns carbon dioxide into carbonate rocks has begun operations in iceland. the engineering experiment by swiss firm <unk> aims to capture 50 tonnes of atmospheric co2 over a year, equalling a us <unk> greenhouse emission. currently $500 per <unk> conversion costs are expected to drop to $50 in the future, said <unk> director. ", first negative emissions plant starts operations in iceland , world's first emissions plant starts operations in iceland , world's negative emissions plant operations 
52, the kannada development authority (kda) on monday directed the bruhat bengaluru mahanagara palike (bbmp) to ensure that all shopping malls and commercial establishments in bengaluru have name boards in kannada within 15 days. this comes after pro-kannada groups defaced name boards of a few shops at a bengaluru mall because they were not in kannada. , b'luru civic body to ensure use of kannada in name boards , b'luru civic body to ensure name in name after boards boards , b'luru civic body to ensure body name 
53," the delhi high court on friday issued a notice to railway authorities after a visually-impaired student was unable to board a train at uttar pradesh's unnao railway station. the student, vaibhav shukla, claimed that this led him to miss his delhi university entrance exam. he added that the door of the coach reserved for disabled passengers was locked during departure. ", hc notice to railways after disabled couldn’t board train , delhi hc notice to railway after couldn’t couldn’t board , delhi hc notice to railway after couldn’t couldn’t board 
54," a woman traveling in an uber cab in mumbai has alleged that she was sexually harassed by the driver, who unzipped his pants and started masturbating in front of her. she added that when she confronted him, he threatened her. the woman said, <unk> to corner me. i was fighting him alone, with the public watching."" "," uber driver masturbated, threatened me, says woman passenger "," uber claims masturbated, harassed me, touched attention in uber "," uber uber masturbated, me, molestation claims in uber "
55," after exiting the ruling nda alliance, tdp chief and andhra pradesh cm chandrababu naidu met several opposition leaders during his two-day visit to delhi to muster support for the state's special status demand. naidu met ncp president sharad pawar, former jammu and kashmir cm farooq abdullah, tmc mp derek o'brien and delhi cm arvind kejriwal among others. ", andhra cm meets opp'n leaders in delhi over special status , andhra cm meets opp'n leaders ahead of gujarat polls , andhra cm cm opp'n leaders continue to appeal 
56," american researchers have developed a technique that would allow them to control the growth rate of human heart cells in a dish by shining a light and varying its <unk> the cells were grown on graphene, 2d form of carbon, which converts light into electricity. the technique could be used for drug testing and developing <unk> pacemakers, said researchers. ", researchers operate lab-grown heart cells by remote control , researchers operate lab-grown heart cells in remote remote remote , researchers operate lab-grown lab-grown cells in 
57," congress leader shashi tharoor on saturday took a jibe at prime minister narendra modi calling him a ""hero on a white <unk> <unk> with an <unk> sword in his hand"". ""modi is a one-man government and everybody's dancing to what he says,"" he said at an event. india now has the ""most centralised <unk> in history, the congress leader added. ", pm modi hero on white <unk> with <unk> sword: tharoor , pm modi calls a a white white sword: tharoor , pm modi hero a a a a sword: 
58," pankaj tripathi, while talking about his dialogue 'sabka aadhaar link hai uske <unk> in 'stree', said the dialogue wasn't the part of the script. ""yeh dialogue pankaj tripathi ka hi hai! i added that <unk> to make the character more fun,"" he added. ""it <unk> to always bring something new to characters, be it theatre or films,"" he further said. ", 'aadhaar' dialogue in 'stree' was not in the script: pankaj , 'aadhaar' dialogue in 'stree' newton to cross <unk> script: pankaj , 'aadhaar' dialogue in 'stree' in 'stree' script: script: 
59," at least seven died and around forty were hospitalised on tuesday night in west bengal after consuming hooch suspected to be laced with <unk> an official said. methyl alcohol, or <unk> is toxic but it is mixed with hooch to increase the intoxicating power of the drink. ""cid will investigate the tragedy,"" state finance and excise minister amit mitra said. "," 7 die, 40 hospitalised after consuming 'hooch' in bengal "," 7 die, die, hospitalised after consuming 'hooch' in chennai "," 7 die, tmc hospitalised in 'hooch' 'hooch' "
60," the cbi had tapped the phones of the class xi ryan international school student's family members for a month over his alleged involvement in the murder of 7-year-old pradyuman thakur, according to reports. the cbi had reportedly delayed the arrest of the teen in order to identify those who were trying to cover up the case by tampering with evidence. ", cbi tapped phones of ryan murder accused's family: reports , cbi tapped phones of ryan murder accused's murder accused's reports , cbi tapped phones of ryan murder accused's family 
61," the police on friday recovered the headless body of a youth who was allegedly abducted by militants earlier this week in jammu and kashmir. the youth was abducted along with his father on wednesday. ""the father had managed to escape from the clutches of his abductors although he sustained a bullet injury. he is now being <unk> police reportedly said. ", headless body of abducted kashmiri youth recovered , headless body of abducted youth recovered youth youth youth , headless body of abducted youth recovered 
62," filmmaker karan johar, along with actress parineeti chopra will appear on farah khan's upcoming show 'lip sing battle'. preity zinta will also make a special appearance on the same episode. 'lip sing battle' is the indian version of american television series 'lip sync battle', in which celebrities compete against each other to perform the best lip sync of famous songs. "," johar, parineeti to appear on farah's show 'lip sing battle' "," johar, parineeti to appear on farah's show 'lip 'lip battle' "," johar, parineeti to appear on farah's 'lip show "
63," protesting against the recent beheading of two indian soldiers in jammu and kashmir, the congress in goa on monday said prime minister narendra modi’s <unk> <unk> has now shrunk to 56 mm. moreover, goa mahila congress president sunita <unk> said, “we are sad that we don’t have a full-time defence minister. the defence minister we had has fled to goa."" ", pm modi's 56-inch chest has shrunk to 56 mm: goa congress , pm modi's 56-inch chest has shrunk to 56 mm: goa cong , pm modi's 56-inch chest to shrunk 56 56 mm: 
